{
  "schema": "adaos.builder.domain_pack.v1",
  "pack_id": "research.compatibility.v1",
  "version": "1.0.0",
  "classification": "compatibility",
  "prompt_rules": [
    {
      "id": "adaos.research.scientific_handoff.v1",
      "title": "Governed scientific handoff",
      "source": "docs/architecture/research-fabric.md",
      "applicability": {
        "facet_keys": [
          "scientific_handoff"
        ]
      },
      "rules": [
        "Treat the accepted experiment system specification and digest as executable subject authority: preserve component settings, arm semantics, intervention boundaries, and locked invariants on the production runner path.",
        "A bounded fixture may reduce cost only where the admitted execution profile permits; it must not substitute another model family, operator, input geometry, output space, or scientific subject.",
        "Emit the required implementation observation from that same path so an independent consumer can detect semantic substitution."
      ]
    },
    {
      "id": "adaos.research.runner_input_policy.v1",
      "title": "Research runner input policy",
      "source": "docs/architecture/research-fabric.md",
      "applicability": {
        "facet_keys": [
          "research_runner"
        ]
      },
      "rules": [
        "For `adaos.research.runner.v1`, select input only from the admitted `request.profile_conditions.input_policy.source`.",
        "`deterministic_contract_fixture` runs bounded production conformance without opening the accepted dataset; `accepted_dataset` selects the admitted dataset path.",
        "Do not add a duplicate private selector under `request.conditions` or infer dataset authority from ambient files."
      ]
    },
    {
      "id": "adaos.research.initial_equivalence.v1",
      "title": "Initial equivalence evidence",
      "source": "docs/architecture/research-fabric.md",
      "applicability": {
        "facet_keys": [
          "initial_equivalence"
        ]
      },
      "rules": [
        "When initial equivalence is required, test it on production operators before training with the same admitted input and shared initialization state for both arms.",
        "Enforce the admitted tolerance directly; a declaration, parameter default, or post-training comparison is not equivalence evidence."
      ]
    }
  ]
}
